;;"Padre Damián Sagrados Corazones ""B""";4 - 3;"Futsal Dante ""B""";CARLOS ARANDA PORTILLO- GABRIEL MORALES CAÑAS;19/05/2018;16:00;Poliesportiu Padre Damián Sagrados Corazones;Jornada 24;1a Territorial B;;03. 1a Territorial 2017-2018;Fútbol sala
;;"Gelida Industrial F.S.C. ""A""";0 - 0;Albelda Futsal;JOEL JIMENEZ RODRIGUEZ- MANUEL MALDONADO LOPEZ- SERGIO RODRIGUEZ PEREZ;19/05/2018;16:15;Pavelló Municipal d'Esports de Gelida;Jornada 24;PRIMERA NACIONAL 2017-18;;02. Primera Nacional 2017-2018;Fútbol sala
;;"F.S. Telic Group Bigues i Riells Juvenil ""A""";7 - 0;F.S. Hostalriquenc Juvenil;JOSEP GONZALEZ GARCIA;19/05/2018;16:30;Pavellon Can Badell- Avinguda Prat de la Riba- Bigues i Riells- Espanya;Jornada 7;"Juvenil ""A""";;07. Juvenil;Fútbol sala
;;F.S. La Salut;0 - 0;CFS Sagrada Familia;DOMENEC FOLGUERA AMPURDANES- ELVIA ELOISA CARDENAS RAMOS;19/05/2018;16:30;Parc Creueta del Coll- Passeig de la Mare de Déu del Coll- Barcelona- Espanya;Jornada 24;1a Territorial B;;03. 1a Territorial 2017-2018;Fútbol sala
;;Atletic Arrahona B;7 - 4;"Orange Futsal Castellbisbal ""B""";BILAL ARROUCHDI;19/05/2018;16:30;Pavelló esports c/ sol i padris- 59 08203 Sabadell;Jornada 27;2a. Territorial A;;04. 2ª Territorial 2017-2018;Fútbol sala
;;C.E.F.S. Granollers C;5 - 1;F.S Union La Salut Badalona A;HERMAN TORTA RECHE- ROGER TORRENT ARNAU;19/05/2018;17:00;PavellÓ Municipal De Can Bassa;Jornada 24;1a Territorial B;;03. 1a Territorial 2017-2018;Fútbol sala
;;C.E. Orange Papiol;7 - 4;A.E. Les Botigues De Sitges;JORDI GAITX PLA- OSCAR KEVIN GUTIERREZ GUTIERREZ- RICARD MARQUEZ SIMONI;19/05/2018;17:00;PavellÓ Poliesportiu Municipal El Papiol;Jornada 24;PRIMERA NACIONAL 2017-18;;02. Primera Nacional 2017-2018;Fútbol sala
;;A.E. Tiana B;2 - 3;F.S. Esclop;ISMAEL BENKHAJOU BAKKALI;19/05/2018;17:00;Poliesportiu Municipal De Tiana;Jornada 27;2a. Territorial A;;04. 2ª Territorial 2017-2018;Fútbol sala
;;C.F.S. La Garriga;0 - 5;C.D Esmeralda Procell F.s.;ANTONIO RUIZ MANCHON- MARC MIRON RUIZ;19/05/2018;17:30;Poliesportiu Can Noguera;Jornada 24;1a Territorial A;;03. 1a Territorial 2017-2018;Fútbol sala
;;Padre Damian Sagrados Corazones;4 - 2;A.C.E. Sansur;CARLOS ARANDA PORTILLO- GABRIEL MORALES CAÑAS- JOAN RAMON BERNARDO MAÑÉ;19/05/2018;18:00;Poliesportiu Padre Damián Sagrados Corazones;Jornada 24;NACIONAL CATALANA 2017-18;;01. Nacional Catalana 2017-2018;Fútbol sala
;;Betània Patmos Barcelona B;6 - 0;C.E.F.S. Granollers B;NICOLAS ANDRES VALBUENA TORRES- PAOLO FORTUNATI RUBEIS;19/05/2018;18:00;Pavelló Universitat de Barcelona- Avinguda Diagonal 695-701 Barcelona;Jornada 24;1a Territorial A;;03. 1a Territorial 2017-2018;Fútbol sala
;;C.e. Gadex B;10 - 2;Futbolmania F.S.;LAUREANO PILAR VILLALBA;19/05/2018;18:00;Pavelló esports c/ sol i padris- 59 08203 Sabadell;Jornada 27;2a. Territorial A;;04. 2ª Territorial 2017-2018;Fútbol sala
;;C.E.F.S. Granollers;2 - 4;A.E. Tiana;HERMAN TORTA RECHE- JOSEP GONZALEZ GARCIA- ROGER TORRENT ARNAU;19/05/2018;19:00;PavellÓ Municipal De Can Bassa;Jornada 24;NACIONAL CATALANA 2017-18;;01. Nacional Catalana 2017-2018;Fútbol sala
;;Betània Patmos Barcelona;1 - 1;F.s. Borges;CARLOS GÓMEZ GONZÁLEZ- NICOLAS ANDRES VALBUENA TORRES- PAOLO FORTUNATI RUBEIS;19/05/2018;19:30;Pavelló Universitat de Barcelona- Avinguda Diagonal 695-701 Barcelona;Jornada 24;NACIONAL CATALANA 2017-18;;01. Nacional Catalana 2017-2018;Fútbol sala
;;Olímpic Argentona;3 - 2;Escola Pia Santa Anna Mataró B;ANTONIO RUIZ MANCHON- MARIANO BURGOS BONAVENTURA;19/05/2018;20:00;Pavelló Municipal d' Argentona;Jornada 24;1a Territorial A;;03. 1a Territorial 2017-2018;Fútbol sala
;;Sants Atletic F.S.;5 - 3;Penya Recreativa Sant Feliu de Llobregat;DAVID GALLARDO BARÓ- MARCO ANTONIO GALLARDO BARÓ;19/05/2018;20:30;Complex Esportiu La Báscula- Barcelona- Espanya;Jornada 24;1a Territorial B;;03. 1a Territorial 2017-2018;Fútbol sala
;;Betis Catalunya F.S.;2 - 1;CFS Ibers Santa Coloma;DOMENEC FOLGUERA AMPURDANES- ELVIA ELOISA CARDENAS RAMOS;20/05/2018;10:30;Poliesportiu Bon Pastor;Jornada 24;1a Territorial B;;03. 1a Territorial 2017-2018;Fútbol sala
;;Teià Futbol Cinc;6 - 0;C.E. Orange Papiol;DAVID GALLARDO BARÓ- DAVID GUILLÉN CUELLAR- MARCO ANTONIO GALLARDO BARÓ;20/05/2018;11:00;Poliesportiu Municipal El Cim- Carrer Josep Puigoriol s/n- Teià;Jornada 9;PRIMERA NACIONAL 2017-18;;02. Primera Nacional 2017-2018;Fútbol sala
;;F.s. Unión Llagostense MecMan B;5 - 9;F.S. Begues;JOEL JIMENEZ RODRIGUEZ- JOSE RIZO GOMEZ- MARI CARMEN DELGADO MORALES;20/05/2018;12:00;Complex esportiu municipal El Turó- Carrer de Joaquim Blume- La Llagosta- Espanya;Jornada 24;PRIMERA NACIONAL 2017-18;;02. Primera Nacional 2017-2018;Fútbol sala
;;Futbol Sala Colomense;3 - 1;Futbol Sala Corbera;MARIANO BURGOS BONAVENTURA;20/05/2018;12:00;Pavelló Esportiu de la Bastida Carrer de Prat de la Riba- s/n 08921 Santa Coloma de Gramenet Barcelona;Jornada 27;2a. Territorial A;;04. 2ª Territorial 2017-2018;Fútbol sala
;;"Olímpic Argentona ""B""";4 - 2;F.S. Viladecavalls;ANTONIO RUIZ MANCHON;20/05/2018;12:00;Pavelló Municipal d' Argentona;Jornada 27;2a. Territorial A;;04. 2ª Territorial 2017-2018;Fútbol sala
;;C.E.S. Sabadell;2 - 6;Betis Catalunya F.S. B;LAUREANO PILAR VILLALBA;20/05/2018;12:00;Complex Esportiu Municipal Sant Oleguer- Camí Can Quadres- Sabadell- Espanya;Jornada 27;2a. Territorial A;;04. 2ª Territorial 2017-2018;Fútbol sala
;;C.e. Gadex B;1 - 5;Atletic Arrahona B;ADRIA VENTEO GONZÁLEZ;20/05/2018;12:15;Pavellò Municipal d'esports Carrer sol i padris a Sabadell;Jornada 21;2a. Territorial A;;04. 2ª Territorial 2017-2018;Fútbol sala
;;C.F.S. Inter Raudovan Hospitalet;5 - 4;C.E. Maristes De Rubí;ALBERT GONZALEZ GARCIA- RAUL GONZALEZ MONJO;20/05/2018;12:15;Poliesportiu Zal Barcelona BCN- Carrer de la Mar Roja- Barcelona- España;Jornada 24;1a Territorial A;;03. 1a Territorial 2017-2018;Fútbol sala
;;F.S Union La Salut Badalona B;4 - 2;"Padre Damián Sagrados Corazones ""C""";DOMENEC FOLGUERA AMPURDANES;20/05/2018;12:30;Polideportivo Municipal Llefia;Jornada 27;2a. Territorial A;;04. 2ª Territorial 2017-2018;Fútbol sala
;;"F.S. Esclop Juvenil ""A""";3 - 3;"F.S. Telic Group Bigues i Riells Juvenil ""A""";PAOLO FORTUNATI RUBEIS;20/05/2018;13:00;Col·legi Públic Gaudí- Carrer d'Ordesa- Sabadell- Espanya;Jornada 11;"Juvenil ""A""";;07. Juvenil;Fútbol sala
;;C.F.S. Clot B;6 - 2;F.S. Tèlic Group Bigues i Riells;ISMAEL CHAMERO RIVERO- MARIANO BURGOS BONAVENTURA- MIQUEL VILASECA BARRUFET;20/05/2018;17:00;CEM Bac de Roda- Rambla de Guipúscoa- Barcelona- Espanya;Jornada 24;PRIMERA NACIONAL 2017-18;;02. Primera Nacional 2017-2018;Fútbol sala
;;C.C.A. Plaza Macael B;3 - 7;A.C.E. Sansur B;JOSE RIZO GOMEZ- NICOLAS ANDRES VALBUENA TORRES;20/05/2018;18:00;Polideportivo Can Vidalet- Esplugues de Llobregat- Espanya;Jornada 24;1a Territorial B;;03. 1a Territorial 2017-2018;Fútbol sala
;;C.F.S. Clot A;6 - 5;Futsal Dante;ISMAEL CHAMERO RIVERO- MARIANO BURGOS BONAVENTURA- MIQUEL VILASECA BARRUFET;20/05/2018;19:00;CEM Bac de Roda- Rambla de Guipúscoa- Barcelona- Espanya;Jornada 24;NACIONAL CATALANA 2017-18;;01. Nacional Catalana 2017-2018;Fútbol sala
;;Athletic Torre Roja;2 - 4;Sagrerenc C.E. B;ALBERTO IGLESIAS PALOMARES- CARLOS GÓMEZ GONZÁLEZ;20/05/2018;19:15;Avinguda dels Germans Gabrielistes- 16- Viladecans- Espanya;Jornada 24;1a Territorial B;;03. 1a Territorial 2017-2018;Fútbol sala
;;C.E. Maristes De Rubí Aleví A;13 - 3;F.S. Llinars Atletic Aleví;DAVID VALIENTE MARTIN;22/05/2018;18:45;Pavello Maristes de Rubi- magallanes 65 Rubi;Jornada 20;"Aleví ""A""";;10. Aleví;Fútbol sala
;;Atlètic Sant Boi;1 - 5;"Olímpic Argentona ""B""";LAUREANO PILAR VILLALBA;22/05/2018;21:00;Colegio Público Josep María Ciurana- Carrer Manuel de Falla- Sant Boi de Llobregat- España;Jornada 26;2a. Territorial A;;04. 2ª Territorial 2017-2018;Fútbol sala
;;AE Empenta - El Pilar Juvenil Nacional;10 - 5;Grup de Joves Can Tusell Juvenil Nacional;ANTONIO RUIZ MANCHON- MARC MIRON RUIZ;25/05/2018;20:15;Pavelló Poliesportiu Municipal de Premià de Mar Camí del Mig- 62- 08330 Premià de Mar- Barcelona;Jornada 15;Juvenil Nacional;;06. Juvenil Nacional;Fútbol sala
;;E.P. Badalona Centre Cadet;7 - 4;Athletic Torre Roja Cadet;GABRIEL MORALES CAÑAS;26/05/2018;10:00;Escola Jungfrau Carrer Vila Vall-Llebrera- s/n- 08911 Badalona;Jornada 21;"Cadet ""B""";;08. Cadet;Fútbol sala
;;Betània Patmos Barcelona Cadet;8 - 4;C.E.F.S. Granollers Cadet;FRANCISCO JAVIER LORENTE PLANA;26/05/2018;10:00;Escola Betània Patmos- Carrer de Montevideo- Barcelona- Espanya;Jornada 21;"Cadet ""B""";;08. Cadet;Fútbol sala
;;F.S Union La Salut Badalona A;6 - 3;Athletic Torre Roja;MARIANO BURGOS BONAVENTURA- MATILDE GOMEZ VIÑARAS;26/05/2018;10:00;CEM Besòs Ronda Sant Ramon de Penyafort s/n 08930 SAnt Adrià de Besòs;Jornada 25;1a Territorial B;;03. 1a Territorial 2017-2018;Fútbol sala
;;Sagrerenc C.E. Pre-benjamí;5 - 3;C.F.S. La Garriga Pre-benjamí;ISMAEL BENKHAJOU BAKKALI;26/05/2018;10:15;Poliesportiu Municipal La Sagrera - C/Honduras- 2 Barcelona;Jornada 10;Pre-benjami Copa;;12. Pre-benjami;Fútbol sala
;;A.E. Moià Cadet;5 - 3;A.E. Tiana Cadet;JORDI GAITX PLA;26/05/2018;10:30;Pavelló Municipal d'Esports- Moià- Espanya;Jornada 21;"Cadet ""A""";;08. Cadet;Fútbol sala
;;Betània Patmos Barcelona Juvenil C;6 - 5;Futbol Sala Corbera Juvenil;FRANCISCO JAVIER LORENTE PLANA;26/05/2018;11:00;Escola Betània Patmos- Carrer de Montevideo- Barcelona- Espanya;Jornada 21;"Juvenil ""B""";;07. Juvenil;Fútbol sala
;;C.E. Maristes De Rubí Aleví B;10 - 1;A.E. Centelles Aleví;DAVID VALIENTE MARTIN;26/05/2018;11:00;Pavello Maristes de Rubi- magallanes 65 Rubi;Jornada 21;"Aleví ""A""";;10. Aleví;Fútbol sala
;;"Olimpic Argentona Aleví ""A""";9 - 3;A.E. Moià Aleví;MARI CARMEN DELGADO MORALES;26/05/2018;11:00;Pavelló Municipal d' Argentona;Jornada 21;"Aleví ""A""";;10. Aleví;Fútbol sala
;;"Escola de Futsal Grèvol Cadet ""B""";6 - 3;Montsant Sala 5 Cadet;JOEL JIMENEZ RODRIGUEZ;26/05/2018;11:15;Pavelló Grèvol- Carrer Provençals- 9 Barcelona;Jornada 21;"Cadet ""B""";;08. Cadet;Fútbol sala
;;A.E. Moià Juvenil;0 - 0;Olimpic Argentona Juvenil;JORDI GAITX PLA;26/05/2018;12:00;Pavelló Municipal d'Esports- Moià- Espanya;Jornada 21;"Juvenil ""A""";;07. Juvenil;Fútbol sala
;;C.C.A. Plaza Macael Juvenil;2 - 5;Athletic Torre Roja Juvenil;JOAN GIBERT REY;26/05/2018;12:00;Polideportivo Can Vidalet- Esplugues de Llobregat- Espanya;Jornada 21;"Juvenil ""B""";;07. Juvenil;Fútbol sala
;;C.E. Gadex Juvenil;8 - 0;A.E. Sallent Juvenil;DAVID VALIENTE MARTIN;26/05/2018;13:00;Poliesportiu Municipal Olimpia Carrer de Mauritània- 17- 08206 Sabadell- España;Jornada 21;"Juvenil ""A""";;07. Juvenil;Fútbol sala
;;"Padre Damián Sagrados Corazones ""C""";4 - 3;Futbol Sala Colomense;JOAN RAMON BERNARDO MAÑÉ;26/05/2018;13:00;Poliesportiu Padre Damián Sagrados Corazones;Jornada 28;2a. Territorial A;;04. 2ª Territorial 2017-2018;Fútbol sala
;;A.E. Sallent Aleví;5 - 2;C.E. Maristes De Rubí Aleví A;RICARD MARQUEZ SIMONI;26/05/2018;13:30;Pavelló D'esports Agustín Rueda de Sallent- C/verge del Pilar s/n;Jornada 21;"Aleví ""A""";;10. Aleví;Fútbol sala
;;"Futbol Sala Corbera Cadet ""B""";3 - 3;C.E. Maristes De Rubí Cadet;JOAN GIBERT REY;26/05/2018;14:00;Pabellón Municipal de Deportes- C/Josep Tarradellas- 08757 Corbera de Llobregat;Jornada 21;"Cadet ""B""";;08. Cadet;Fútbol sala
;;Futsal Dante;5 - 3;C.F.S. Clot A;CARLOS GÓMEZ GONZÁLEZ- JOAN RAMON BERNARDO MAÑÉ- NICOLAS ANDRES VALBUENA TORRES;26/05/2018;15:00;pavelló de Parque de la Creueta del Coll- Passeig de la Mare de Déu del Coll- Barcelona- España;Jornada 11;NACIONAL CATALANA 2017-18;;01. Nacional Catalana 2017-2018;Fútbol sala
;;A.C. Coloso Juvenil Nacional;7 - 3;Grup de Joves Can Tusell Juvenil Nacional;ISMAEL BENKHAJOU BAKKALI- OMAR DOUAS BERROHOUY;26/05/2018;16:00;Complex Esportiu Marina Besòs- Sant Adrià de Besòs- Espanya;Jornada 18;Juvenil Nacional;;06. Juvenil Nacional;Fútbol sala
;;Banús Futsal Juvenil Nacional;1 - 6;Jesuïtes Clot Juvenil Nacional;DOMENEC FOLGUERA AMPURDANES- ELVIA ELOISA CARDENAS RAMOS;26/05/2018;16:00;Pavelló Fundación Valldor 7;Jornada 18;Juvenil Nacional;;06. Juvenil Nacional;Fútbol sala
;;C.E. Maristes De Rubí Juvenil;1 - 2;Montsant Sala 5 Juvenil;JOEL JIMENEZ RODRIGUEZ;26/05/2018;16:00;Pavello Maristes de Rubi- magallanes 65 Rubi;Jornada 21;"Juvenil ""B""";;07. Juvenil;Fútbol sala
;;"Futbol Sala Corbera Cadet ""A""";4 - 0;C.f.s. Alcalà Prat - Bar La Terraza Cadet;JOAN GIBERT REY;26/05/2018;16:00;Pabellón Municipal de Deportes- C/Josep Tarradellas- 08757 Corbera de Llobregat;Jornada 21;"Cadet ""A""";;08. Cadet;Fútbol sala
;;"Padre Damián Sagrados Corazones ""B""";0 - 0;CFS Sagrada Familia;JONATHAN GALVIS ARANGO- MARIANO BURGOS BONAVENTURA;26/05/2018;16:00;Poliesportiu Padre Damián Sagrados Corazones;Jornada 25;1a Territorial B;;03. 1a Territorial 2017-2018;Fútbol sala
;;Penya Recreativa Sant Feliu de Llobregat;4 - 2;F.S. La Salut;ALBERTO IGLESIAS PALOMARES- GABRIEL MORALES CAÑAS;26/05/2018;16:00;Pavelló Andrei Xepkin Carrer Mataró- 4- 08980 Sant Feliu de Llobregat- Barcelona;Jornada 25;1a Territorial B;;03. 1a Territorial 2017-2018;Fútbol sala
;;"Gelida Industrial F.S.C. ""A""";6 - 2;C.F.S. Lliça De Vall;JOSE RIZO GOMEZ- MANUEL MALDONADO LOPEZ- MARI CARMEN DELGADO MORALES;26/05/2018;16:15;Pavelló Municipal d'Esports de Gelida;Jornada 25;PRIMERA NACIONAL 2017-18;;02. Primera Nacional 2017-2018;Fútbol sala
;;"F.S. Tèlic Group Bigues i Riells Juvenil ""B""";2 - 5;C.F.S. La Garriga Juvenil A;ANTONIO RUIZ MANCHON;26/05/2018;16:30;Pavellon Can Badell- Avinguda Prat de la Riba- Bigues i Riells- Espanya;Jornada 21;"Juvenil ""B""";;07. Juvenil;Fútbol sala
;;A.C.E. Sansur B;0 - 2;Betis Catalunya F.S.;FRANCISCO JAVIER LORENTE PLANA- MATILDE GOMEZ VIÑARAS;26/05/2018;16:30;Poliesportiu Espanya Industrial;Jornada 25;1a Territorial B;;03. 1a Territorial 2017-2018;Fútbol sala
;;Grup de Joves Can Tusell Cadet;9 - 3;A.E. Sallent Cadet;DAVID VALIENTE MARTIN;26/05/2018;17:00;Pista Pol. De Can Tusell (gespa Artificial);Jornada 21;"Cadet ""A""";;08. Cadet;Fútbol sala
;;F.S. Llinars Atletic Aleví;4 - 5;F.S. Llinars Aleví;BILAL ARROUCHDI;26/05/2018;17:00;Pavelló annex de Llinars del Vallès - Av. Pau Casals- 22-24- 08450 Llinars del Vallès- Barcelona;Jornada 21;"Aleví ""A""";;10. Aleví;Fútbol sala
;;F.S. Racing Llavaneres;3 - 4;Teià Futbol Cinc B;OSCAR KEVIN GUTIERREZ GUTIERREZ- RICARD MARQUEZ SIMONI;26/05/2018;17:00;Poliesportiu De Sant Andreu De Llavaneres;Jornada 25;1a Territorial A;;03. 1a Territorial 2017-2018;Fútbol sala
;;Sagrerenc C.E. B;6 - 0;C.C.A. Plaza Macael B;HERMAN TORTA RECHE- JOSE ANTONIO SABIDO GATO;26/05/2018;17:00;Poliesportiu Municipal La Sagrera - C/Honduras- 2 Barcelona;Jornada 25;1a Territorial B;;03. 1a Territorial 2017-2018;Fútbol sala
;;C.E. Maristes De Rubí;6 - 4;C.e. Gadex;DOMENEC FOLGUERA AMPURDANES- ELVIA ELOISA CARDENAS RAMOS;26/05/2018;17:45;Pavello Maristes de Rubi- magallanes 65 Rubi;Jornada 25;1a Territorial A;;03. 1a Territorial 2017-2018;Fútbol sala
;;A.C.E. Sansur;5 - 3;F.S. Unión Llagostense MecMan;FRANCISCO JAVIER LORENTE PLANA- MARIANO BURGOS BONAVENTURA- MATILDE GOMEZ VIÑARAS;26/05/2018;18:00;Poliesportiu Espanya Industrial;Jornada 25;NACIONAL CATALANA 2017-18;;01. Nacional Catalana 2017-2018;Fútbol sala
;;Betània Patmos Barcelona B;4 - 0;Escola Pia Santa Anna Mataró B;JOAN GIBERT REY- JONATHAN GALVIS ARANGO;26/05/2018;18:00;Pavelló Universitat de Barcelona- Avinguda Diagonal 695-701 Barcelona;Jornada 25;1a Territorial A;;03. 1a Territorial 2017-2018;Fútbol sala
;;F.S. Begues;5 - 4;C.F.S. Clot B;JOAN RAMON BERNARDO MAÑÉ- JOSE PEDRO CASES FERNANDEZ- MARIANO BENITO HERRERO;26/05/2018;18:00;Pavello Jaume Viñas Pi Club de Futbol Begues Carrer dels Esports- s/n 08859 Begues;Jornada 25;PRIMERA NACIONAL 2017-18;;02. Primera Nacional 2017-2018;Fútbol sala
;;A.E.F.S. Montgat;2 - 3;C.f.s. Alcalà Prat - Bar La Terraza;DAVID GALLARDO BARÓ- DAVID GUILLÉN CUELLAR- MARCO ANTONIO GALLARDO BARÓ;26/05/2018;18:00;Pavelló Municipal De Montgat;Jornada 25;PRIMERA NACIONAL 2017-18;;02. Primera Nacional 2017-2018;Fútbol sala
;;A.E. Tiana;1 - 2;Betània Patmos Barcelona;ANTONIO RUIZ MANCHON- DAVID VALIENTE MARTIN- NICOLAS ANDRES VALBUENA TORRES;26/05/2018;18:30;Poliesportiu Municipal De Tiana;Jornada 25;NACIONAL CATALANA 2017-18;;01. Nacional Catalana 2017-2018;Fútbol sala
;;Can Palet FS;4 - 6;"Athletic Arrahona - Can Jonqueres ""A""";ALBERTO IGLESIAS PALOMARES- GABRIEL MORALES CAÑAS;26/05/2018;19:15;Zona Esportiva Municipal Can Jofresa Carrer de Badalona- 4-6 08223 Terrassa;Jornada 24;1a Territorial A;;03. 1a Territorial 2017-2018;Fútbol sala
;;Grup de Joves Can Tusell Juvenil Nacional;0 - 0;Jesuïtes Clot Juvenil Nacional;ALBERTO IGLESIAS PALOMARES- LAUREANO PILAR VILLALBA;27/05/2018;09:00;Poliesportiu Municipal De Sant Llorenç Carrer del Castellsapera- 0- 08221 Terrassa- Barcelona;Jornada 16;Juvenil Nacional;;06. Juvenil Nacional;Fútbol sala
;;Atlètic Sant Boi;3 - 4;Atletic Arrahona B;MARCO ANTONIO GALLARDO BARÓ;27/05/2018;09:30;Colegio Público Josep María Ciurana- Carrer Manuel de Falla- Sant Boi de Llobregat- España;Jornada 28;2a. Territorial A;;04. 2ª Territorial 2017-2018;Fútbol sala
;;Futsal Dante;4 - 5;C.E.F.S. Granollers;JOAN GIBERT REY- JONATHAN GALVIS ARANGO- SAMUEL SERRANO MATA;27/05/2018;10:00;Parc Creueta del Coll- Passeig de la Mare de Déu del Coll- Barcelona- Espanya;Jornada 25;NACIONAL CATALANA 2017-18;;01. Nacional Catalana 2017-2018;Fútbol sala
;;"Orange Futsal Castellbisbal ""B""";5 - 11;F.S Union La Salut Badalona B;DAVID VALIENTE MARTIN;27/05/2018;10:00;Pista Municipal de Castellbisbal- C/agricultura s/n Castellbisbal;Jornada 28;2a. Territorial A;;04. 2ª Territorial 2017-2018;Fútbol sala
;;Grup de Joves Can Tusell Cadet;5 - 3;A.E. Tiana Cadet;DAVID VALIENTE MARTIN;27/05/2018;11:30;Pista Pol. De Can Tusell (gespa Artificial);Jornada 9;"Cadet ""A""";;08. Cadet;Fútbol sala
;;"Montsant Sala 5 ""A""";4 - 1;Sagrerenc C.E. A;JOSE RIZO GOMEZ- MARI CARMEN DELGADO MORALES- MATILDE GOMEZ VIÑARAS;27/05/2018;11:45;Institut Barcelona Congrés- Carrer del Baró d'Esponellà- Barcelona- Espanya;Jornada 25;NACIONAL CATALANA 2017-18;;01. Nacional Catalana 2017-2018;Fútbol sala
;;"Futsal Dante ""B""";4 - 2;C.E.F.S. Granollers C;JONATHAN GALVIS ARANGO- SAMUEL SERRANO MATA;27/05/2018;11:45;Parc Creueta del Coll- Passeig de la Mare de Déu del Coll- Barcelona- Espanya;Jornada 25;1a Territorial B;;03. 1a Territorial 2017-2018;Fútbol sala
;;C.E.F.S. Granollers B;2 - 2;C.D Esmeralda Procell F.s.;HERMAN TORTA RECHE- JOEL JIMENEZ RODRIGUEZ;27/05/2018;12:00;PavellÓ Municipal De Can Bassa;Jornada 25;1a Territorial A;;03. 1a Territorial 2017-2018;Fútbol sala
;;C.E.S. Sabadell;1 - 3;C.e. Gadex B;MARIANO BURGOS BONAVENTURA;27/05/2018;12:00;Complex Esportiu Municipal Sant Oleguer- Camí Can Quadres- Sabadell- Espanya;Jornada 28;2a. Territorial A;;04. 2ª Territorial 2017-2018;Fútbol sala
;;Teià F5 Juvenil Nacional;2 - 3;F.s. Unión Llagostense MecMan Juvenil Nacional;PABLO GARCIA LLUBIA;27/05/2018;12:30;Poliesportiu Municipal El Cim- Carrer Josep Puigoriol s/n- Teià;Jornada 18;Juvenil Nacional;;06. Juvenil Nacional;Fútbol sala
;;C.F.S. La Garriga;5 - 5;C.F.S. Inter Raudovan Hospitalet;ALBERTO IGLESIAS PALOMARES- DAVID GUILLÉN CUELLAR;27/05/2018;12:30;Can Violí- Avinguda 11 de Setembre- s/n- 08530 La Garriga- Barcelona;Jornada 25;1a Territorial A;;03. 1a Territorial 2017-2018;Fútbol sala
;;"Athletic Arrahona - Can Jonqueres ""A""";4 - 3;Olímpic Argentona;MARCO ANTONIO GALLARDO BARÓ- NICOLAS ANDRES VALBUENA TORRES;27/05/2018;13:00;Cem Sud- Carrer de Pardo Bazán- Sabadell- Espanya;Jornada 25;1a Territorial A;;03. 1a Territorial 2017-2018;Fútbol sala
;;Neurofutbol F.S.;3 - 5;Futsal Dante Cadet;GABRIEL MORALES CAÑAS;27/05/2018;14:00;Ciudad Deportiva Fundación Marcet- Av. Can Marcet- 08035 Barcelona;Jornada 21;"Cadet ""B""";;08. Cadet;Fútbol sala
;;F.S. Viladecavalls;3 - 6;Montsant Sala5 B;MARIANO BURGOS BONAVENTURA;27/05/2018;15:00;poliesportiu municipal de viladecavalls;Jornada 28;2a. Territorial A;;04. 2ª Territorial 2017-2018;Fútbol sala
;;Futbol Sala Corbera;5 - 2;Futbolmania F.S.;DAVID GUILLÉN CUELLAR;27/05/2018;16:00;Pabellón Municipal de Deportes- C/Josep Tarradellas- 08757 Corbera de Llobregat;Jornada 26;2a. Territorial A;;04. 2ª Territorial 2017-2018;Fútbol sala
;;F.s. Borges;3 - 3;Padre Damian Sagrados Corazones;DAVID MACARULLA CASTAÑEDA- ELI GASCÓN PEREIRO- JUAN JOSE GONZALEZ PAVON;27/05/2018;17:00;PAVELLO MUNICIPAL DE LES BORGES BLANQUES;Jornada 25;NACIONAL CATALANA 2017-18;;01. Nacional Catalana 2017-2018;Fútbol sala
;;E.F.S. Alta Segarra Juvenil Nacional;6 - 6;AE Empenta - El Pilar Juvenil Nacional;ELI GASCÓN PEREIRO- OSCAR CRUZ OSUNA;27/05/2018;18:00;Pavelló Municipal De Calaf;Jornada 18;Juvenil Nacional;;06. Juvenil Nacional;Fútbol sala
;;CFS Ibers Santa Coloma;3 - 7;Sants Atletic F.S.;ALBERT GONZALEZ GARCIA- MATILDE GOMEZ VIÑARAS;27/05/2018;18:00;Pavelló Esportiu de la Bastida Carrer de Prat de la Riba- s/n 08921 Santa Coloma de Gramenet Barcelona;Jornada 25;1a Territorial B;;03. 1a Territorial 2017-2018;Fútbol sala
;;Betis Catalunya F.S. B;4 - 2;A.E. Tiana B;MARCO ANTONIO GALLARDO BARÓ;27/05/2018;18:30;Poliesportiu Bon Pastor;Jornada 28;2a. Territorial A;;04. 2ª Territorial 2017-2018;Fútbol sala
;;A.E. Les Botigues De Sitges;4 - 4;Escola Pia Santa Anna Mataró;ALBERTO IGLESIAS PALOMARES- DAVID GUILLÉN CUELLAR- GABRIEL MORALES CAÑAS;27/05/2018;19:00;Pavelló Can Roca- Carrer del Castanyer- s/n 08860 Castelldefels- Barcelona;Jornada 25;PRIMERA NACIONAL 2017-18;;02. Primera Nacional 2017-2018;Fútbol sala
;;E.F.S. Alta Segarra;2 - 3;E.F.S. Ripoll;ELI GASCÓN PEREIRO- GERMAN MARTIN FERNANDEZ- OSCAR CRUZ OSUNA;27/05/2018;20:00;Pavelló Municipal De Calaf;Jornada 25;NACIONAL CATALANA 2017-18;;01. Nacional Catalana 2017-2018;Fútbol sala
